{
  "schema_version": 1,
  "id": "worked-anonymized-shape",
  "origin": "anonymized-example",
  "evaluation": {
    "start": "2026-01-05T00:00:00.000000+00:00",
    "end": "2026-01-05T04:00:00.000000+00:00"
  },
  "incidents": [
    {
      "id": "burst",
      "resource_id": "aaaaaaaa-aaaa-4aaa-8aaa-aaaaaaaaaaa1",
      "window": {
        "start": "2026-01-05T00:00:00.000000+00:00",
        "end": "2026-01-05T01:00:00.000000+00:00"
      },
      "expected_class": "threshold"
    },
    {
      "id": "shift",
      "resource_id": "aaaaaaaa-aaaa-4aaa-8aaa-aaaaaaaaaaa1",
      "window": {
        "start": "2026-01-05T01:00:00.000000+00:00",
        "end": "2026-01-05T02:00:00.000000+00:00"
      },
      "expected_class": "anomaly"
    },
    {
      "id": "missing",
      "resource_id": "aaaaaaaa-aaaa-4aaa-8aaa-aaaaaaaaaaa1",
      "window": {
        "start": "2026-01-05T02:00:00.000000+00:00",
        "end": "2026-01-05T03:00:00.000000+00:00"
      },
      "expected_class": "coverage"
    }
  ],
  "quiet": [
    {
      "start": "2026-01-05T03:00:00.000000+00:00",
      "end": "2026-01-05T04:00:00.000000+00:00"
    }
  ],
  "labelled": [{"resource_id": "aaaaaaaa-aaaa-4aaa-8aaa-aaaaaaaaaaa1", "window": {
    "start": "2026-01-05T00:00:00.000000+00:00", "end": "2026-01-05T04:00:00.000000+00:00"
  }}],
  "series": [
    {
      "resource_id": "aaaaaaaa-aaaa-4aaa-8aaa-aaaaaaaaaaa1",
      "metric": "filesystem_used_bytes",
      "rows": [
        {
          "ts": 1767312000,
          "v": 18000000000
        },
        {
          "ts": 1767312060,
          "v": 18000000000
        },
        {
          "ts": 1767312120,
          "v": 18000000000
        },
        {
          "ts": 1767312180,
          "v": 18000000000
        },
        {
          "ts": 1767312240,
          "v": 18000000000
        },
        {
          "ts": 1767315600,
          "v": 18000000000
        },
        {
          "ts": 1767315660,
          "v": 18000000000
        },
        {
          "ts": 1767315720,
          "v": 18000000000
        },
        {
          "ts": 1767315780,
          "v": 18000000000
        },
        {
          "ts": 1767315840,
          "v": 18000000000
        },
        {
          "ts": 1767319200,
          "v": 18000000000
        },
        {
          "ts": 1767319260,
          "v": 18000000000
        },
        {
          "ts": 1767319320,
          "v": 18000000000
        },
        {
          "ts": 1767319380,
          "v": 18000000000
        },
        {
          "ts": 1767319440,
          "v": 18000000000
        },
        {
          "ts": 1767322800,
          "v": 18000000000
        },
        {
          "ts": 1767322860,
          "v": 18000000000
        },
        {
          "ts": 1767322920,
          "v": 18000000000
        },
        {
          "ts": 1767322980,
          "v": 18000000000
        },
        {
          "ts": 1767323040,
          "v": 18000000000
        },
        {
          "ts": 1767398400,
          "v": 20000000000
        },
        {
          "ts": 1767398460,
          "v": 20000000000
        },
        {
          "ts": 1767398520,
          "v": 20000000000
        },
        {
          "ts": 1767398580,
          "v": 20000000000
        },
        {
          "ts": 1767398640,
          "v": 20000000000
        },
        {
          "ts": 1767402000,
          "v": 20000000000
        },
        {
          "ts": 1767402060,
          "v": 20000000000
        },
        {
          "ts": 1767402120,
          "v": 20000000000
        },
        {
          "ts": 1767402180,
          "v": 20000000000
        },
        {
          "ts": 1767402240,
          "v": 20000000000
        },
        {
          "ts": 1767405600,
          "v": 20000000000
        },
        {
          "ts": 1767405660,
          "v": 20000000000
        },
        {
          "ts": 1767405720,
          "v": 20000000000
        },
        {
          "ts": 1767405780,
          "v": 20000000000
        },
        {
          "ts": 1767405840,
          "v": 20000000000
        },
        {
          "ts": 1767409200,
          "v": 20000000000
        },
        {
          "ts": 1767409260,
          "v": 20000000000
        },
        {
          "ts": 1767409320,
          "v": 20000000000
        },
        {
          "ts": 1767409380,
          "v": 20000000000
        },
        {
          "ts": 1767409440,
          "v": 20000000000
        },
        {
          "ts": 1767484800,
          "v": 22000000000
        },
        {
          "ts": 1767484860,
          "v": 22000000000
        },
        {
          "ts": 1767484920,
          "v": 22000000000
        },
        {
          "ts": 1767484980,
          "v": 22000000000
        },
        {
          "ts": 1767485040,
          "v": 22000000000
        },
        {
          "ts": 1767488400,
          "v": 22000000000
        },
        {
          "ts": 1767488460,
          "v": 22000000000
        },
        {
          "ts": 1767488520,
          "v": 22000000000
        },
        {
          "ts": 1767488580,
          "v": 22000000000
        },
        {
          "ts": 1767488640,
          "v": 22000000000
        },
        {
          "ts": 1767492000,
          "v": 22000000000
        },
        {
          "ts": 1767492060,
          "v": 22000000000
        },
        {
          "ts": 1767492120,
          "v": 22000000000
        },
        {
          "ts": 1767492180,
          "v": 22000000000
        },
        {
          "ts": 1767492240,
          "v": 22000000000
        },
        {
          "ts": 1767495600,
          "v": 22000000000
        },
        {
          "ts": 1767495660,
          "v": 22000000000
        },
        {
          "ts": 1767495720,
          "v": 22000000000
        },
        {
          "ts": 1767495780,
          "v": 22000000000
        },
        {
          "ts": 1767495840,
          "v": 22000000000
        },
        {
          "ts": 1767571200,
          "v": 96000000000
        },
        {
          "ts": 1767571260,
          "v": 96000000000
        },
        {
          "ts": 1767571320,
          "v": 96000000000
        },
        {
          "ts": 1767571380,
          "v": 96000000000
        },
        {
          "ts": 1767571440,
          "v": 96000000000
        },
        {
          "ts": 1767574800,
          "v": 32000000000
        },
        {
          "ts": 1767574860,
          "v": 32000000000
        },
        {
          "ts": 1767574920,
          "v": 32000000000
        },
        {
          "ts": 1767574980,
          "v": 32000000000
        },
        {
          "ts": 1767575040,
          "v": 32000000000
        },
        {
          "ts": 1767582000,
          "v": 20000000000
        },
        {
          "ts": 1767582060,
          "v": 20000000000
        },
        {
          "ts": 1767582120,
          "v": 20000000000
        },
        {
          "ts": 1767582180,
          "v": 20000000000
        },
        {
          "ts": 1767582240,
          "v": 20000000000
        }
      ]
    }
  ]
}
